{
  "$schema": "https://json-schema.org/draft/2020-12/schema",
  "title": "Scoreboard Colors",
  "description": "RGB color overrides for scoreboard UI elements.",
  "x-indent": "  ",
  "type": "object",
  "required": ["format"],
  "properties": {
    "x-schema": {
      "type": "string",
      "default": "./../schemas/colors/scoreboard.schema.json",
      "readOnly": true,
      "x-enforceConst": true,
      "x-hidden": true
    },
    "format": {
      "type": "number",
      "const": 9.0,
      "default": 9.0,
      "x-hidden": true
    },
    "bases": {
      "type": "object",
      "x-format": "grid",
      "properties": {
        "1B": { "$ref": "#/$defs/color", "default": {"r": 255, "g": 235, "b": 59} },
        "2B": { "$ref": "#/$defs/color", "default": {"r": 255, "g": 235, "b": 59} },
        "3B": { "$ref": "#/$defs/color", "default": {"r": 255, "g": 235, "b": 59} }
      },
      "additionalProperties": false
    },
    "final": {
      "type": "object",
      "x-format": "grid",
      "properties": {
        "inning":         { "$ref": "#/$defs/color", "default": {"r": 255, "g": 235, "b": 59} },
        "scrolling_text": { "$ref": "#/$defs/color", "default": {"r": 255, "g": 235, "b": 59} },
        "record":         { "$ref": "#/$defs/color", "default": {"r": 160, "g": 148, "b": 40} },
        "nohit_text":     { "$ref": "#/$defs/color", "default": {"r": 255, "g": 50,  "b": 50}  }
      },
      "additionalProperties": false
    },
    "inning": {
      "type": "object",
      "x-format": "grid",
      "properties": {
        "break": {
          "type": "object",
          "x-format": "grid",
          "properties": {
            "number":           { "$ref": "#/$defs/color", "default": {"r": 255, "g": 235, "b": 59} },
            "text":             { "$ref": "#/$defs/color", "default": {"r": 255, "g": 235, "b": 59} },
            "due_up":           { "$ref": "#/$defs/color", "default": {"r": 255, "g": 235, "b": 59} },
            "due_up_divider":   { "$ref": "#/$defs/color", "default": {"r": 255, "g": 235, "b": 59} },
            "due_up_names":     { "$ref": "#/$defs/color", "default": {"r": 255, "g": 235, "b": 59} },
            "inactive":         { "$ref": "#/$defs/color", "default": {"r": 100, "g": 90, "b": 22} }
          },
          "additionalProperties": false
        },
        "number": { "$ref": "#/$defs/color", "default": {"r": 255, "g": 235, "b": 59} },
        "arrow": {
          "type": "object",
          "x-format": "grid",
          "properties": {
            "active":   { "$ref": "#/$defs/color", "default": {"r": 255, "g": 235, "b": 59} },
            "inactive": { "$ref": "#/$defs/color", "default": {"r": 100, "g": 90,  "b": 22} }
          },
          "additionalProperties": false
        }
      },
      "additionalProperties": false
    },
    "outs": {
      "type": "object",
      "x-format": "grid",
      "properties": {
        "fill": {
          "type": "object",
          "x-format": "grid",
          "properties": {
            "1": { "$ref": "#/$defs/color", "default": {"r": 255, "g": 235, "b": 59} }
          },
          "additionalProperties": false
        },
        "1": { "$ref": "#/$defs/color", "default": {"r": 255, "g": 235, "b": 59} },
        "2": { "$ref": "#/$defs/color", "default": {"r": 255, "g": 235, "b": 59} },
        "3": { "$ref": "#/$defs/color", "default": {"r": 255, "g": 235, "b": 59} }
      },
      "additionalProperties": false
    },
    "abs_challenges": {
      "type": "object",
      "x-format": "grid",
      "properties": {
        "available": { "$ref": "#/$defs/color", "default": {"r": 255, "g": 235, "b": 59} },
        "used":      { "$ref": "#/$defs/color", "default": {"r": 100, "g": 90,  "b": 22} }
      },
      "additionalProperties": false
    },
    "atbat": {
      "type": "object",
      "x-format": "grid",
      "properties": {
        "batter":       { "$ref": "#/$defs/color", "default": {"r": 255, "g": 235, "b": 59}  },
        "pitcher":      { "$ref": "#/$defs/color", "default": {"r": 255, "g": 235, "b": 59}  },
        "pitch":        { "$ref": "#/$defs/color", "default": {"r": 255, "g": 255, "b": 255} },
        "pitch_count":  { "$ref": "#/$defs/color", "default": {"r": 255, "g": 255, "b": 255} },
        "play_result":  { "$ref": "#/$defs/color", "default": {"r": 255, "g": 235, "b": 59}  },
        "strikeout":    { "$ref": "#/$defs/color", "default": {"r": 255, "g": 0,   "b": 0}   },
        "batter_stats":       { "$ref": "#/$defs/color", "default": {"r": 255, "g": 235, "b": 59} },
        "batter_stats_label": { "$ref": "#/$defs/color", "default": {"r": 80,  "g": 70,  "b": 20} }
      },
      "additionalProperties": false
    },
    "batter_count":       { "$ref": "#/$defs/color", "default": {"r": 255, "g": 235, "b": 59}  },
    "line_score": {
      "type": "object",
      "x-format": "grid",
      "description": "Line score furniture. The run values themselves take each team's text colour from colors/teams.json, so they stay legible on either band.",
      "properties": {
        "label":  { "$ref": "#/$defs/color", "default": {"r": 120, "g": 112, "b": 70}  },
        "marker": { "$ref": "#/$defs/color", "default": {"r": 255, "g": 235, "b": 59}  }
      },
      "additionalProperties": false
    },
    "nohit_text":         { "$ref": "#/$defs/color", "default": {"r": 255, "g": 110, "b": 110} },
    "perfect_game_text":  { "$ref": "#/$defs/color", "default": {"r": 255, "g": 110, "b": 110} },
    "pregame": {
      "type": "object",
      "x-format": "grid",
      "properties": {
        "matchup":        { "$ref": "#/$defs/color", "default": {"r": 255, "g": 235, "b": 59} },
        "scrolling_text": { "$ref": "#/$defs/color", "default": {"r": 255, "g": 235, "b": 59} },
        "start_time":     { "$ref": "#/$defs/color", "default": {"r": 255, "g": 235, "b": 59} },
        "warmup_text":    { "$ref": "#/$defs/color", "default": {"r": 255, "g": 235, "b": 59} }
      },
      "additionalProperties": false
    },
    "status": {
      "type": "object",
      "x-format": "grid",
      "properties": {
        "text":           { "$ref": "#/$defs/color", "default": {"r": 255, "g": 235, "b": 59} },
        "scrolling_text": { "$ref": "#/$defs/color", "default": {"r": 255, "g": 235, "b": 59} }
      },
      "additionalProperties": false
    },
    "standings": {
      "type": "object",
      "x-format": "grid",
      "properties": {
        "nl": {
          "type": "object",
          "x-format": "grid",
          "properties": {
            "divider": { "$ref": "#/$defs/color", "default": {"r": 0,   "g": 0,   "b": 255} }
          },
          "additionalProperties": false
        },
        "al": {
          "type": "object",
          "x-format": "grid",
          "properties": {
            "divider": { "$ref": "#/$defs/color", "default": {"r": 255, "g": 0,   "b": 0}   }
          },
          "additionalProperties": false
        },
        "background": { "$ref": "#/$defs/color", "default": {"r": 37,  "g": 102, "b": 30}  },
        "divider":    { "$ref": "#/$defs/color", "default": {"r": 13,  "g": 35,  "b": 11}  },
        "stat":       { "$ref": "#/$defs/color", "default": {"r": 171, "g": 181, "b": 170} },
        "team": {
          "type": "object",
          "x-format": "grid",
          "properties": {
            "name":     { "$ref": "#/$defs/color", "default": {"r": 171, "g": 181, "b": 170} },
            "elim":     { "$ref": "#/$defs/color", "default": {"r": 190, "g": 180, "b": 160} },
            "clinched": { "$ref": "#/$defs/color", "default": {"r": 180, "g": 210, "b": 175} },
            "stat":     { "$ref": "#/$defs/color", "default": {"r": 171, "g": 181, "b": 170} }
          },
          "additionalProperties": false
        },
        "text": { "$ref": "#/$defs/color", "default": {"r": 255, "g": 235, "b": 59} }
      },
      "additionalProperties": false
    },
    "news": {
      "type": "object",
      "x-format": "grid",
      "properties": {
        "scrolling_text": { "$ref": "#/$defs/color", "default": {"r": 255, "g": 235, "b": 59} },
        "time":           { "$ref": "#/$defs/color", "default": {"r": 255, "g": 235, "b": 59} },
        "conditions":     { "$ref": "#/$defs/color", "default": {"r": 255, "g": 235, "b": 59} },
        "temperature":    { "$ref": "#/$defs/color", "default": {"r": 255, "g": 235, "b": 59} },
        "wind_speed":     { "$ref": "#/$defs/color", "default": {"r": 255, "g": 235, "b": 59} },
        "wind_dir":       { "$ref": "#/$defs/color", "default": {"r": 255, "g": 235, "b": 59} },
        "wind":           { "$ref": "#/$defs/color", "default": {"r": 255, "g": 235, "b": 59} },
        "weather_icon":   { "$ref": "#/$defs/color", "default": {"r": 255, "g": 235, "b": 59} },
        "text":           { "$ref": "#/$defs/color", "default": {"r": 255, "g": 235, "b": 59} }
      },
      "additionalProperties": false
    },
    "network": {
      "type": "object",
      "x-format": "grid",
      "properties": {
        "background": { "$ref": "#/$defs/color", "default": {"r": 255, "g": 0,   "b": 0}   },
        "text":       { "$ref": "#/$defs/color", "default": {"r": 255, "g": 255, "b": 255} }
      },
      "additionalProperties": false
    },
    "plugins": {
      "type": "object",
      "additionalProperties": {
        "type": "object",
        "additionalProperties": {
          "$ref": "#/$defs/color"
        }
      },
      "default": {}
    },
    "default": {
      "type": "object",
      "x-format": "grid",
      "properties": {
        "background": { "$ref": "#/$defs/color", "default": {"r": 7, "g": 14, "b": 25} }
      },
      "additionalProperties": false
    }
  },
  "$defs": {
    "color": { "$ref": "./_common.schema.json#/$defs/color" }
  },
  "additionalProperties": false
}
