{
  "$schema": "./../schemas/colors/scoreboard.schema.json",
  "format": 9.0,
  "bases": {
    "1B": {
      "r": 255,
      "g": 235,
      "b": 59
    },
    "2B": {
      "r": 255,
      "g": 235,
      "b": 59
    },
    "3B": {
      "r": 255,
      "g": 235,
      "b": 59
    }
  },
  "final": {
    "inning": {
      "r": 255,
      "g": 235,
      "b": 59
    },
    "scrolling_text": {
      "r": 255,
      "g": 235,
      "b": 59
    },
    "record": {
      "r": 160,
      "g": 148,
      "b": 40
    },
    "nohit_text": {
      "r": 255,
      "g": 50,
      "b": 50
    }
  },
  "inning": {
    "break": {
      "number": {
        "r": 255,
        "g": 235,
        "b": 59
      },
      "text": {
        "r": 255,
        "g": 235,
        "b": 59
      },
      "due_up": {
        "r": 255,
        "g": 235,
        "b": 59
      },
      "due_up_divider": {
        "r": 255,
        "g": 235,
        "b": 59
      },
      "due_up_names": {
        "r": 255,
        "g": 235,
        "b": 59
      },
      "inactive": {
        "r": 100,
        "g": 90,
        "b": 22
      }
    },
    "number": {
      "r": 255,
      "g": 235,
      "b": 59
    },
    "arrow": {
      "active": {
        "r": 255,
        "g": 235,
        "b": 59
      },
      "inactive": {
        "r": 100,
        "g": 90,
        "b": 22
      }
    }
  },
  "outs": {
    "fill": {
      "1": {
        "r": 255,
        "g": 235,
        "b": 59
      }
    },
    "1": {
      "r": 255,
      "g": 235,
      "b": 59
    },
    "2": {
      "r": 255,
      "g": 235,
      "b": 59
    },
    "3": {
      "r": 255,
      "g": 235,
      "b": 59
    }
  },
  "abs_challenges": {
    "available": {
      "r": 255,
      "g": 235,
      "b": 59
    },
    "used": {
      "r": 100,
      "g": 90,
      "b": 22
    }
  },
  "atbat": {
    "batter": {
      "r": 255,
      "g": 235,
      "b": 59
    },
    "pitcher": {
      "r": 255,
      "g": 235,
      "b": 59
    },
    "pitch": {
      "r": 255,
      "g": 255,
      "b": 255
    },
    "pitch_count": {
      "r": 255,
      "g": 255,
      "b": 255
    },
    "play_result": {
      "r": 255,
      "g": 235,
      "b": 59
    },
    "strikeout": {
      "r": 255,
      "g": 0,
      "b": 0
    },
    "batter_stats": {
      "r": 255,
      "g": 235,
      "b": 59
    },
    "batter_stats_label": {
      "r": 80,
      "g": 70,
      "b": 20
    }
  },
  "batter_count": {
    "r": 255,
    "g": 235,
    "b": 59
  },
  "line_score": {
    "label": {
      "r": 120,
      "g": 112,
      "b": 70
    },
    "marker": {
      "r": 255,
      "g": 235,
      "b": 59
    }
  },
  "nohit_text": {
    "r": 255,
    "g": 110,
    "b": 110
  },
  "perfect_game_text": {
    "r": 255,
    "g": 110,
    "b": 110
  },
  "pregame": {
    "matchup": {
      "r": 255,
      "g": 235,
      "b": 59
    },
    "scrolling_text": {
      "r": 255,
      "g": 235,
      "b": 59
    },
    "start_time": {
      "r": 255,
      "g": 235,
      "b": 59
    },
    "warmup_text": {
      "r": 255,
      "g": 235,
      "b": 59
    }
  },
  "status": {
    "text": {
      "r": 255,
      "g": 235,
      "b": 59
    },
    "scrolling_text": {
      "r": 255,
      "g": 235,
      "b": 59
    }
  },
  "standings": {
    "nl": {
      "divider": {
        "r": 0,
        "g": 0,
        "b": 255
      }
    },
    "al": {
      "divider": {
        "r": 255,
        "g": 0,
        "b": 0
      }
    },
    "background": {
      "r": 37,
      "g": 102,
      "b": 30
    },
    "divider": {
      "r": 13,
      "g": 35,
      "b": 11
    },
    "stat": {
      "r": 171,
      "g": 181,
      "b": 170
    },
    "team": {
      "name": {
        "r": 171,
        "g": 181,
        "b": 170
      },
      "elim": {
        "r": 190,
        "g": 180,
        "b": 160
      },
      "clinched": {
        "r": 180,
        "g": 210,
        "b": 175
      },
      "stat": {
        "r": 171,
        "g": 181,
        "b": 170
      }
    },
    "text": {
      "r": 255,
      "g": 235,
      "b": 59
    }
  },
  "news": {
    "scrolling_text": {
      "r": 255,
      "g": 235,
      "b": 59
    },
    "time": {
      "r": 255,
      "g": 235,
      "b": 59
    },
    "conditions": {
      "r": 255,
      "g": 235,
      "b": 59
    },
    "temperature": {
      "r": 255,
      "g": 235,
      "b": 59
    },
    "wind_speed": {
      "r": 255,
      "g": 235,
      "b": 59
    },
    "wind_dir": {
      "r": 255,
      "g": 235,
      "b": 59
    },
    "wind": {
      "r": 255,
      "g": 235,
      "b": 59
    },
    "weather_icon": {
      "r": 255,
      "g": 235,
      "b": 59
    },
    "text": {
      "r": 255,
      "g": 235,
      "b": 59
    }
  },
  "network": {
    "background": {
      "r": 255,
      "g": 0,
      "b": 0
    },
    "text": {
      "r": 255,
      "g": 255,
      "b": 255
    }
  },
  "plugins": {},
  "default": {
    "background": {
      "r": 7,
      "g": 14,
      "b": 25
    }
  }
}
